<?xml version="1.0" encoding="UTF-8"?>
<xs:schema xmlns:xs="http://www.w3.org/2001/XMLSchema">

    <xs:complexType name="CourierType">
        <xs:sequence>
            <xs:element name="id" type="xs:integer"/>
            <xs:element name="firstName" type="xs:string"/>
            <xs:element name="lastName" type="xs:string"/>
            <xs:element name="companyId" type="xs:int"/>
        </xs:sequence>
    </xs:complexType>

    <xs:complexType name="CompanyType">
        <xs:sequence>
            <xs:element name="id" type="xs:integer"/>
            <xs:element name="name" type="xs:string"/>
            <xs:element name="couriers" minOccurs="0">
                <xs:complexType>
                    <xs:sequence>
                        <xs:element name="courier" type="CourierType" maxOccurs="unbounded"/>
                    </xs:sequence>
                </xs:complexType>
            </xs:element>
        </xs:sequence>
    </xs:complexType>

    <xs:element name="company" type="CompanyType"/>

</xs:schema>